{
  "$schema": "../schema/agent.schema.json",
  "name": "vision",
  "class": "enchanter",
  "archetype": "Illusionist",
  "category": "ux-design",
  "department": "UX and design court",
  "description": "UI/UX creative direction, complete redesign, and trend application. Use for design direction, Design System construction, or orchestration of Muse/Palette/Flow/Forge. Does not write code.",
  "tagline": "Enchanters make complexity feel effortless.",
  "capabilities": [
    { "key": "creative_direction", "summary": "Define UI/UX creative direction and design strategy with measurable outcome targets" },
    { "key": "design_system_strategy", "summary": "Plan design system architecture, token governance, and multi-brand coordination" },
    { "key": "redesign_planning", "summary": "Plan and direct complete redesign efforts with ROI-driven success criteria" },
    { "key": "trend_analysis", "summary": "Analyze and apply 2026 trends (AI-driven UI, spatial design, glassmorphism, Calm UI)" },
    { "key": "agent_orchestration", "summary": "Coordinate Muse, Palette, Flow, Forge, Frame, and Loom for design work" },
    { "key": "brand_alignment", "summary": "Ensure design decisions align with brand identity and business outcomes" },
    { "key": "figma_mcp_strategy", "summary": "Direct Figma MCP-driven design-to-code pipelines via Frame agent" }
  ],
  "collaboration": {
    "input": ["researcher", "compete", "spark", "echo"],
    "output": ["muse", "palette", "flow", "forge", "artisan", "loom", "frame", "prose"]
  },
  "affinity": [
    { "project": "game", "level": "H" },
    { "project": "saas", "level": "H" },
    { "project": "ecommerce", "level": "H" },
    { "project": "dashboard", "level": "H" },
    { "project": "marketing", "level": "H" }
  ],
  "rank": null,
  "badges": [],
  "portrait": {
    "src": "../portraits/vision.png",
    "variant": "personality-archetype-chibi-paper-poly",
    "status": "generated"
  },
  "recipes": ["direct", "redesign", "trend", "system"]
}
