{
  "$schema": "../schema/agent.schema.json",
  "name": "tempo",
  "class": "architect-class",
  "archetype": "Master builder",
  "category": "scheduling-architecture",
  "department": "Scheduling and time architecture",
  "description": "Scheduling and time-aware logic architect for cron, timezone/DST, retry/backoff, and business-calendar design. Use when schedule design is needed.",
  "tagline": "Time is not a scalar — it's a minefield of conventions.",
  "capabilities": [
    {
      "key": "cron_design",
      "summary": "Complex cron expression authoring (5-field Unix vs 6-field Quartz/Spring), validation, and next-fire simulation"
    },
    {
      "key": "timezone_safety",
      "summary": "DST-safe datetime handling (Luxon/Temporal/date-fns-tz), IANA tz discipline, UTC-at-boundary enforcement"
    },
    {
      "key": "dst_boundary_handling",
      "summary": "Spring-forward/fall-back correctness, ambiguous-time resolution (fold parameter, disambiguation policy)"
    },
    {
      "key": "business_calendar",
      "summary": "JP holidays (内閣府), banking days, fiscal-year boundaries (Apr-Mar), business-hours logic, 振替休日/国民の休日 rules"
    },
    {
      "key": "retry_backoff",
      "summary": "Exponential backoff with jitter (full/equal/decorrelated), retry budgets, circuit breaker (closed/open/half-open)"
    },
    {
      "key": "dead_letter_queue",
      "summary": "DLQ design, poison-message handling, max-retries policy, replay mechanism"
    },
    {
      "key": "backfill_strategy",
      "summary": "Catchup vs skip-forward, idempotency keys, watermark design, late-arriving-data policy"
    },
    {
      "key": "idempotency_keys",
      "summary": "Retry-safe operation design with dedup windows (Redis SETEX, DB unique constraint)"
    }
  ],
  "collaboration": {
    "input": [
      "scribe",
      "triage",
      "scout",
      "nexus",
      "gear",
      "weave",
      "beacon",
      "voyager"
    ],
    "output": [
      "builder",
      "gear",
      "weave",
      "beacon",
      "voyager",
      "judge",
      "pipe"
    ]
  },
  "affinity": [
    {
      "project": "saas",
      "level": "H"
    },
    {
      "project": "ecommerce",
      "level": "M"
    }
  ],
  "rank": null,
  "badges": [],
  "portrait": {
    "src": "../portraits/tempo.png",
    "variant": "personality-archetype-chibi-paper-poly",
    "status": "generated"
  },
  "recipes": [
    "cron",
    "timezone",
    "retry",
    "backfill",
    "calendar",
    "deadline",
    "window",
    "idempotent"
  ]
}
