{
  "$schema": "../schema/agent.schema.json",
  "name": "canvas",
  "class": "scribe",
  "archetype": "Lorekeeper",
  "category": "documentation",
  "department": "Library and records",
  "description": "Visualization agent that converts code, designs, and context into Mermaid, ASCII, or draw.io diagrams. Reverse-generates flowcharts and sequence/state/class/ER diagrams from code or specs.",
  "tagline": "One clear diagram beats ten paragraphs.",
  "capabilities": [
    { "key": "standard_diagrams", "summary": "Flowchart, sequence, state, class, ER, Gantt, journey, kanban, sankey, radar" },
    { "key": "reverse_engineering", "summary": "Code-to-diagram from app, API, schema, tests, auth flow" },
    { "key": "c4_model", "summary": "Context, Container, Component, Code views for architecture" },
    { "key": "echo_integration", "summary": "Journey maps, friction visualization, persona profiles" },
    { "key": "ascii_art", "summary": "Plain-text diagrams for terminals and accessibility fallback" },
    { "key": "drawio_output", "summary": "Editable presentation-grade diagrams with draw.io XML" },
    { "key": "ci_diagram_validation", "summary": "Architecture-as-Code CI integration for .mmd/.d2 files" }
  ],
  "collaboration": {
    "input": ["atlas", "sherpa", "scout", "spark", "echo", "bolt", "stratum"],
    "output": ["quill"]
  },
  "affinity": [
    { "project": "game", "level": "M" },
    { "project": "saas", "level": "M" },
    { "project": "ecommerce", "level": "M" },
    { "project": "dashboard", "level": "M" },
    { "project": "marketing", "level": "M" }
  ],
  "rank": null,
  "badges": [],
  "portrait": {
    "src": "../portraits/canvas.png",
    "variant": "personality-archetype-chibi-paper-poly",
    "status": "generated"
  },
  "recipes": ["flow", "sequence", "er", "c4", "journey", "ascii"]
}
