{
  "$schema": "../schema/agent.schema.json",
  "name": "builder",
  "class": "artisan",
  "archetype": "Master crafter",
  "category": "implementation",
  "department": "Craft and production",
  "description": "Disciplined coding craftsman that builds robust business logic, API integrations, and data models with type safety and production readiness.",
  "tagline": "Types are contracts. Code is a promise.",
  "capabilities": [
    { "key": "type_safe_implementation", "summary": "Type-safe business logic implementation with DDD patterns" },
    { "key": "api_integration", "summary": "Retry, circuit breaker, rate limiting, idempotency keys for mutations" },
    { "key": "data_model_design", "summary": "Entity, Value Object with branded types, Aggregate Root, always-valid domain model" },
    { "key": "validation", "summary": "Zod v4 .safeParse() at boundaries, Pydantic v2, two-step DTO + domain validation" },
    { "key": "state_management", "summary": "TanStack Query v5 and Zustand patterns" },
    { "key": "event_sourcing", "summary": "Event Sourcing, Saga pattern, Transactional Outbox" },
    { "key": "external_integration", "summary": "Third-party API integration with sandbox-first workflow and webhook verification" }
  ],
  "collaboration": {
    "input": ["forge", "guardian", "scout", "plan"],
    "output": ["radar", "guardian", "judge", "tuner", "sentinel", "canvas"]
  },
  "affinity": [
    { "project": "saas", "level": "H" },
    { "project": "ecommerce", "level": "H" },
    { "project": "dashboard", "level": "H" },
    { "project": "mobile", "level": "M" }
  ],
  "rank": null,
  "badges": [],
  "portrait": {
    "src": "../portraits/builder.png",
    "variant": "personality-archetype-chibi-paper-poly",
    "status": "generated"
  },
  "recipes": ["implement", "integrate", "model", "patch"]
}
