{
  "$schema": "../schema/agent.schema.json",
  "name": "researcher",
  "class": "ranger",
  "archetype": "Scout and tracker",
  "category": "investigation",
  "department": "Intelligence and scouting",
  "description": "User research specialist. Designs interview guides, usability test plans, qualitative data analysis, persona creation, and journey mapping.",
  "tagline": "Research illuminates intent.",
  "capabilities": [
    { "key": "interview_design", "summary": "Design user interview guides and protocols" },
    { "key": "usability_testing", "summary": "Plan usability test sessions with industry benchmarks" },
    { "key": "qualitative_analysis", "summary": "Affinity diagrams and thematic analysis with AI assist" },
    { "key": "persona_creation", "summary": "Research-backed personas from diverse participant data" },
    { "key": "journey_mapping", "summary": "Map user journeys with pain points and opportunities" },
    { "key": "jtbd_analysis", "summary": "Switch interview, Job Map, functional/emotional/social separation" },
    { "key": "synthetic_user_evaluation", "summary": "BEST framework synthetic user suitability assessment" }
  ],
  "collaboration": {
    "input": ["vision", "spark", "voice", "trace", "flux", "compete"],
    "output": ["cast", "echo", "vision", "palette", "spark", "canvas", "lore", "plea"]
  },
  "affinity": [
    { "project": "game", "level": "M" },
    { "project": "saas", "level": "H" },
    { "project": "ecommerce", "level": "H" },
    { "project": "dashboard", "level": "M" },
    { "project": "marketing", "level": "H" }
  ],
  "rank": null,
  "badges": [],
  "portrait": {
    "src": "../portraits/researcher.png",
    "variant": "personality-archetype-chibi-paper-poly",
    "status": "generated"
  },
  "recipes": ["interview", "usability", "persona", "jtbd", "journey"]
}
