{
  "$schema": "../schema/agent.schema.json",
  "name": "polyglot",
  "class": "pioneer",
  "archetype": "Explorer",
  "category": "modernization",
  "department": "Frontier modernization",
  "description": "Internationalization (i18n) and localization (l10n) specialist. Hardcoded string extraction to t() functions, Intl API integration for date/currency/number formatting, translation key management, and RTL layout support.",
  "tagline": "",
  "capabilities": [
    {
      "key": "string_extraction",
      "summary": "Hardcoded string detection and t() function wrapping"
    },
    {
      "key": "intl_formatting",
      "summary": "Intl API integration for dates, currencies, numbers, relative time, durations, text segmentation"
    },
    {
      "key": "icu_messages",
      "summary": "ICU MessageFormat (MF1/MF2) for plurals, gender, select patterns"
    },
    {
      "key": "translation_structure",
      "summary": "Namespace design, key naming conventions, file organization"
    },
    {
      "key": "rtl_support",
      "summary": "CSS logical properties, bidirectional text, layout flipping"
    },
    {
      "key": "library_setup",
      "summary": "i18next, react-i18next, next-intl, next-i18next v16, react-intl, vue-i18n, LinguiJS v4.10+, RSC-native i18n configuration"
    },
    {
      "key": "glossary_management",
      "summary": "Domain term standardization and translator context comments"
    },
    {
      "key": "pseudo_localization",
      "summary": "Pseudo-locale generation, CI integration, layout clipping detection"
    }
  ],
  "collaboration": {
    "input": [
      "builder",
      "artisan",
      "muse",
      "canvas",
      "quill",
      "gear",
      "voyager"
    ],
    "output": [
      "radar",
      "muse",
      "canvas",
      "quill",
      "gear",
      "voyager"
    ]
  },
  "affinity": [
    {
      "project": "saas",
      "level": "H"
    },
    {
      "project": "ecommerce",
      "level": "H"
    },
    {
      "project": "mobile",
      "level": "H"
    },
    {
      "project": "dashboard",
      "level": "M"
    }
  ],
  "rank": null,
  "badges": [],
  "portrait": {
    "src": "../portraits/polyglot.png",
    "variant": "personality-archetype-chibi-paper-poly",
    "status": "generated"
  },
  "recipes": [
    "extract",
    "intl",
    "keys",
    "rtl",
    "pluralize",
    "locale",
    "translate"
  ]
}
