{
  "$schema": "../schema/agent.schema.json",
  "name": "gauge",
  "class": "demiurge",
  "archetype": "World shaper",
  "category": "meta-tooling",
  "department": "Ecosystem meta layer",
  "description": "Normalization audit and self-evolving compliance agent. Scans SKILL.md files against the 16-item checklist, classifies violations, produces actionable fix snippets, and researches emerging best practices via web sources. Does not write code.",
  "tagline": "",
  "capabilities": [
    {
      "key": "normalization_audit",
      "summary": "Scan SKILL.md files against the 16-item normalization checklist (F1, L1, H1-H3, S1-S9, A1-A2)"
    },
    {
      "key": "violation_classification",
      "summary": "Assign PASS/PARTIAL/FAIL per item with P0-P3 priority ranking"
    },
    {
      "key": "fix_generation",
      "summary": "Produce concrete fix snippets using Quest as exemplar, not abstract suggestions"
    },
    {
      "key": "ecosystem_dashboard",
      "summary": "Generate compliance matrices and health scores across all agents"
    },
    {
      "key": "best_practice_evolution",
      "summary": "Web research to discover and integrate emerging skill design patterns"
    },
    {
      "key": "self_evolution",
      "summary": "Safely update own detection patterns and checklist via tiered safety levels"
    },
    {
      "key": "drift_detection",
      "summary": "Track compliance score deltas between scans using stability index thresholds (<10% stable, 10-20% investigate, >20% intervene)"
    },
    {
      "key": "rule_calibration",
      "summary": "Monitor per-rule false positive/negative rates and recalibrate rules exceeding 15% FP threshold"
    }
  ],
  "collaboration": {
    "input": [
      "architect",
      "darwin",
      "ecosystem",
      "lore",
      "beacon",
      "nexus",
      "sigil",
      "sentinel"
    ],
    "output": [
      "architect",
      "darwin",
      "nexus",
      "sigil",
      "sentinel"
    ]
  },
  "affinity": [
    {
      "project": "game",
      "level": "M"
    },
    {
      "project": "saas",
      "level": "M"
    },
    {
      "project": "ecommerce",
      "level": "M"
    },
    {
      "project": "dashboard",
      "level": "M"
    },
    {
      "project": "marketing",
      "level": "M"
    }
  ],
  "rank": null,
  "badges": [],
  "portrait": {
    "src": "../portraits/gauge.png",
    "variant": "personality-archetype-chibi-paper-poly",
    "status": "generated"
  },
  "recipes": [
    "audit",
    "fix",
    "research",
    "checklist"
  ]
}
