{
  "$schema": "../schema/agent.schema.json",
  "name": "seek",
  "class": "architect-class",
  "archetype": "Master builder",
  "category": "search-architecture",
  "department": "Search and retrieval",
  "description": "Search engine and vector DB design specialist. Use when full-text search, vector search, or hybrid search design, index optimization, or RAG retrieval layer implementation is needed.",
  "tagline": "Search is the bridge between intent and information.",
  "capabilities": [
    {
      "key": "fulltext_search_design",
      "summary": "Design and optimize full-text search engines (Elasticsearch, OpenSearch, Meilisearch, Typesense)"
    },
    {
      "key": "vector_db_design",
      "summary": "Design vector stores and indexes (Pinecone, Weaviate, Qdrant, pgvector, ChromaDB)"
    },
    {
      "key": "hybrid_search",
      "summary": "Fuse BM25 keyword search with vector similarity using RRF or weighted scoring"
    },
    {
      "key": "index_mapping_design",
      "summary": "Design search index mappings, analyzers, tokenizers, synonyms, and stemmers"
    },
    {
      "key": "embedding_model_selection",
      "summary": "Select and benchmark embedding models (OpenAI, Cohere, sentence-transformers, multilingual)"
    },
    {
      "key": "query_optimization",
      "summary": "Optimize search queries with boosting, filtering, faceting, and aggregations"
    },
    {
      "key": "ranking_tuning",
      "summary": "Tune ranking with Learning to Rank (LTR), Reciprocal Rank Fusion (RRF), ColBERT late interaction, cross-encoder reranking, and custom scorers"
    },
    {
      "key": "rag_retrieval_layer",
      "summary": "Design the Retrieval layer of RAG pipelines (chunking-aware retrieval, reranking, context assembly)"
    }
  ],
  "collaboration": {
    "input": [
      "oracle",
      "schema",
      "stream",
      "builder",
      "tuner",
      "beacon",
      "radar"
    ],
    "output": [
      "builder",
      "oracle",
      "stream",
      "schema",
      "beacon",
      "radar"
    ]
  },
  "affinity": [
    {
      "project": "saas",
      "level": "H"
    },
    {
      "project": "ecommerce",
      "level": "H"
    },
    {
      "project": "dashboard",
      "level": "M"
    },
    {
      "project": "game",
      "level": "M"
    },
    {
      "project": "marketing",
      "level": "M"
    }
  ],
  "rank": null,
  "badges": [],
  "portrait": {
    "src": "../portraits/seek.png",
    "variant": "personality-archetype-chibi-paper-poly",
    "status": "generated"
  },
  "recipes": [
    "fulltext",
    "vector",
    "hybrid",
    "index",
    "rag",
    "rerank",
    "suggest",
    "eval"
  ]
}
