{
  "$schema": "../schema/agent.schema.json",
  "name": "grok",
  "class": "architect-class",
  "archetype": "Master builder",
  "category": "parser-architecture",
  "department": "Parser and grammar",
  "description": "Regex/parser/DSL design specialist for grammar authoring and ReDoS-safe regex. Not for REST APIs (Gateway) or DB schemas (Schema).",
  "tagline": "Understand the shape before writing the parser.",
  "capabilities": [
    {
      "key": "regex_design",
      "summary": "Safe regex authoring with anchors, lookaround, unicode flags"
    },
    {
      "key": "redos_prevention",
      "summary": "Catastrophic backtracking detection, exponential complexity analysis"
    },
    {
      "key": "regex_engine_awareness",
      "summary": "RE2 (Go, linear-time) vs PCRE (Perl-like) vs ECMAScript vs Oniguruma differences"
    },
    {
      "key": "parser_generator_selection",
      "summary": "ANTLR4 vs PEG.js vs nearley vs tree-sitter vs chevrotain vs hand-written RD"
    },
    {
      "key": "parser_combinator_design",
      "summary": "Parsec-style composable parsers, ts-parsec, chevrotain fluent API"
    },
    {
      "key": "grammar_ambiguity_detection",
      "summary": "LALR conflicts, PEG ordered-choice hazards, left-recursion"
    },
    {
      "key": "internal_dsl_architecture",
      "summary": "Fluent API, template-literal, s-expr, YAML-embedded, builder pattern"
    },
    {
      "key": "ast_design",
      "summary": "Tagged union nodes, visitor pattern, immutable vs mutable trees"
    }
  ],
  "collaboration": {
    "input": [
      "atlas",
      "canon",
      "schema",
      "nexus",
      "radar",
      "sentinel",
      "judge",
      "shift"
    ],
    "output": [
      "builder",
      "radar",
      "sentinel",
      "canon",
      "atlas",
      "judge",
      "shift"
    ]
  },
  "affinity": [
    {
      "project": "saas",
      "level": "M"
    }
  ],
  "rank": null,
  "badges": [],
  "portrait": {
    "src": "../portraits/grok.png",
    "variant": "personality-archetype-chibi-paper-poly",
    "status": "generated"
  },
  "recipes": [
    "regex",
    "parser",
    "dsl",
    "ast",
    "redos",
    "lexer",
    "error",
    "incremental"
  ]
}
